{
  "schema_version": "h3-focus-plan-v1",
  "profile": "local_t8",
  "mode": "Ref2VA",
  "duration_seconds": 20,
  "media_assets": [
    {
      "asset_id": "video-1",
      "kind": "video",
      "ordinal": 1,
      "official_label": "<Video 1>",
      "source": {
        "handle": "uploads/video-1",
        "clock_id": "main",
        "clock_offset_seconds": 0
      },
      "probe": {
        "duration_seconds": 120,
        "fps": 30,
        "frame_count": 3600
      },
      "role": "structure_reference",
      "selected": true,
      "selected_window": {
        "in_seconds": 0,
        "out_seconds": 2
      },
      "definition": "is a reference for the cup scene.",
      "retention": {
        "relationship": "weak_reference",
        "placement": "",
        "details": "Its broad qualities guide the scene."
      },
      "model_input": {
        "fps": 24,
        "frame_count": 48
      }
    }
  ],
  "subjects": [],
  "shots": [
    {
      "id": "shot-a",
      "order": 1,
      "cut_seconds": 0,
      "composition": "A close shot frames a ceramic cup.",
      "subject_ids": [],
      "subject_description": "The cup has a blue rim.",
      "environment": "A plain wooden table fills the frame.",
      "action": "The cup slowly turns.",
      "camera": "The camera remains still.",
      "sound": "",
      "dialogue": [],
      "visible_text": [],
      "reference_placements": []
    }
  ],
  "style": "Live-action.",
  "ref2va": {
    "task_types": [
      "reference generation"
    ],
    "summary": "The cup scene uses <Video 1>."
  },
  "overall_soundscape": "Quiet room tone continues.",
  "non_diegetic_music": "N/A",
  "locks": [
    {
      "path": "/style",
      "value": "Live-action."
    }
  ],
  "gaps": [],
  "segmentation": {
    "strategy": "uniform_edit",
    "clock": "source_seconds",
    "clock_id": "main",
    "global_prompt": "Keep the cup blue.",
    "shared_lock_paths": [
      "/style"
    ],
    "segments": [
      {
        "id": "segment-1",
        "order": 1,
        "source_window": {
          "in_seconds": 0,
          "out_seconds": 10
        },
        "local_prompt": "",
        "selections": [
          {
            "asset_id": "video-1",
            "timing": "synchronized",
            "window": {
              "in_seconds": 0,
              "out_seconds": 10
            },
            "model_input": {
              "fps": 24,
              "frame_count": 240
            }
          }
        ]
      },
      {
        "id": "segment-2",
        "order": 2,
        "source_window": {
          "in_seconds": 10,
          "out_seconds": 20
        },
        "local_prompt": "",
        "selections": [
          {
            "asset_id": "video-1",
            "timing": "synchronized",
            "window": {
              "in_seconds": 10,
              "out_seconds": 20
            },
            "model_input": {
              "fps": 24,
              "frame_count": 240
            }
          }
        ]
      }
    ]
  }
}
