{
  "schema_version": "h3-focus-plan-v1",
  "profile": "local_t8",
  "mode": "T2VA",
  "duration_seconds": 6,
  "media_assets": [],
  "subjects": [],
  "shots": [
    {
      "id": "shot-a",
      "order": 1,
      "cut_seconds": 0,
      "composition": "A close shot frames a ceramic cup.",
      "subject_ids": [],
      "subject_description": "The cup has a blue rim.",
      "environment": "A plain wooden table fills the frame.",
      "action": "The cup slowly turns.",
      "camera": "The camera remains still.",
      "sound": "",
      "dialogue": [],
      "visible_text": [],
      "reference_placements": []
    }
  ],
  "style": "Live-action.",
  "ref2va": {
    "task_types": [],
    "summary": ""
  },
  "overall_soundscape": "Quiet room tone continues.",
  "non_diegetic_music": "N/A",
  "locks": [],
  "gaps": [],
  "segmentation": {
    "strategy": "none",
    "clock": "source_seconds",
    "clock_id": "main",
    "global_prompt": "",
    "shared_lock_paths": [],
    "segments": []
  }
}
