{
  "schema_version": "h3-focus-plan-v1",
  "profile": "local_t8",
  "mode": "Ref2VA",
  "duration_seconds": 6,
  "media_assets": [
    {
      "asset_id": "picture-1",
      "kind": "picture",
      "source": {
        "handle": "uploads/cup-1.png"
      },
      "probe": {
        "width": 640,
        "height": 480
      },
      "ordinal": 1,
      "official_label": "<Picture 1>",
      "role": "subject_source",
      "selected": true,
      "selected_window": null
    }
  ],
  "subjects": [
    {
      "subject_id": "cup",
      "ordinal": 1,
      "official_label": "<Subject 1>",
      "source_asset_ids": [
        "picture-1"
      ],
      "definition": "is the ceramic cup in <Picture 1>, with a blue rim.",
      "retention": {
        "relationship": "fully_preserved",
        "placement": "appears in [Shot 1]",
        "details": "The blue rim and ceramic surface are retained."
      }
    }
  ],
  "shots": [
    {
      "id": "shot-a",
      "order": 1,
      "cut_seconds": 0,
      "composition": "A close shot frames a ceramic cup.",
      "subject_ids": [
        "cup"
      ],
      "subject_description": "<Subject 1> has a blue rim.",
      "environment": "A plain wooden table fills the frame.",
      "action": "The cup slowly turns.",
      "camera": "The camera remains still.",
      "sound": "",
      "dialogue": [],
      "visible_text": [],
      "reference_placements": []
    }
  ],
  "style": "Live-action.",
  "ref2va": {
    "task_types": [
      "reference generation"
    ],
    "summary": "<Subject 1> slowly rotates on a wooden table."
  },
  "overall_soundscape": "Quiet room tone continues.",
  "non_diegetic_music": "N/A",
  "locks": [],
  "gaps": [],
  "segmentation": {
    "strategy": "none",
    "clock": "source_seconds",
    "clock_id": "main",
    "global_prompt": "",
    "shared_lock_paths": [],
    "segments": []
  }
}
